{
  "schema": "ai-ppt-plus/outline-contract/v1",
  "project_id": "project-slug",
  "outline_id": "outline-main",
  "outline_revision": "R1",
  "outline_path": "outline.csv",
  "outline_sha256": "",
  "slide_count": 1,
  "approval": {
    "status": "draft",
    "approved_by": null,
    "approved_at": null
  },
  "rows": [
    {
      "slide_no": 1,
      "row_sha256": "",
      "status": "draft",
      "title": "",
      "core_message": "",
      "body_content": ""
    }
  ],
  "source_references": [],
  "supersedes": null,
  "change_log": [],
  "created_at": "2026-08-31T00:00:00Z"
}
